{
  "$schema": "../schema/combat_art.schema.json",
  "id": "boss",
  "label": "Boss",
  "order": 2,
  "width": 3,
  "height": 3,
  "palette": 7,
  "frame0": [
    "combat_top_left_boss", "combat_top_middle_boss", "combat_top_right_boss",
    "combat_left_middle_boss", "combat_middle_center_boss", "combat_middle_right_boss",
    "combat_bottom_left_boss", "combat_bottom_middle_boss", "combat_bottom_right_boss"
  ]
}
